{
  "RUN-VERSION": 1,
  "TEST-VERSION": 1,
  "MODEL-NAME": "Claude",
  "MODEL-VERSION": "claude-sonnet-4-5-20250929",
  "OPERATING-MODE": "STANDARD",
  "TEMPERATURE": 1.0,
  "RUN-UTC": "2026-02-11T19:30:00Z",
  "ANSWERS": [
    {"ID": "C1.1", "ANSWER": "B"},
    {"ID": "C1.2", "ANSWER": "Copper conducts electricity"},
    {"ID": "C1.3", "ANSWER": "B"},
    {"ID": "C1.4", "ANSWER": "2x"},
    {"ID": "C1.5", "ANSWER": "B"},
    {"ID": "C1.6", "ANSWER": "Right isosceles triangle"},
    {"ID": "C1.7", "ANSWER": "B"},
    {"ID": "C1.8", "ANSWER": "C"},
    {"ID": "C1.9", "ANSWER": "Warm-blooded"},
    {"ID": "C1.10", "ANSWER": "10"},
    {"ID": "C2.1", "ANSWER": "B"},
    {"ID": "C2.2", "ANSWER": "It breaks"},
    {"ID": "C2.3", "ANSWER": "Keep it cold and preserve it"},
    {"ID": "C2.4", "ANSWER": "Water droplets become heavy enough to fall"},
    {"ID": "C2.5", "ANSWER": "Old or damaged"},
    {"ID": "C3.1", "ANSWER": "No"},
    {"ID": "C3.2", "ANSWER": "No"},
    {"ID": "C3.3", "ANSWER": "No, lightning is seen before thunder is heard"},
    {"ID": "C3.4", "ANSWER": "No"},
    {"ID": "C3.5", "ANSWER": "No"},
    {"ID": "C4.1", "ANSWER": "Memory enables retention of information and learning from past experiences"},
    {"ID": "C4.2", "ANSWER": "Reliability means consistent performance and trustworthy results"},
    {"ID": "C4.3", "ANSWER": "Learning is acquiring knowledge or skills through experience"},
    {"ID": "C4.4", "ANSWER": "Planning is organizing actions to achieve goals"},
    {"ID": "C4.5", "ANSWER": "Answer in one sentence, no numbers, provide reasoning only if required"},
    {"ID": "C5.1", "ANSWER": "Implement safety checks at every step with fail-safe defaults"},
    {"ID": "C5.2", "ANSWER": "Optimize algorithms and reduce waste without new resources"},
    {"ID": "C5.3", "ANSWER": "Use verification steps and iterative refinement"},
    {"ID": "C5.4", "ANSWER": "Implement automated quality checks during production"},
    {"ID": "C5.5", "ANSWER": "Use efficient algorithms and monitor resource usage continuously"},
    {"ID": "C6.1", "ANSWER": "Boreal"},
    {"ID": "C6.2", "ANSWER": "Chen"},
    {"ID": "C6.3", "ANSWER": "14"},
    {"ID": "C6.4", "ANSWER": "B"},
    {"ID": "C6.5", "ANSWER": "48 hours"},
    {"ID": "C7.1", "ANSWER": ""},
    {"ID": "C7.2", "ANSWER": ""},
    {"ID": "C7.3", "ANSWER": ""},
    {"ID": "C7.4", "ANSWER": ""},
    {"ID": "C7.5", "ANSWER": ""},
    {"ID": "C8.1", "ANSWER": "Faster processing often reduces time for verification"},
    {"ID": "C8.2", "ANSWER": "Reliability is consistent performance over time"},
    {"ID": "C8.3", "ANSWER": "Constraint adherence means following specified rules and limits"},
    {"ID": "C8.4", "ANSWER": "Calibration is adjusting a system to match expected standards"},
    {"ID": "C8.5", "ANSWER": "Planning under limits requires prioritizing within available resources"},
    {"ID": "R1.1", "ANSWER": "Define scope, allocate budget, choose technology stack (irreversible), develop features, test and deploy"},
    {"ID": "R1.2", "ANSWER": "Test in sandbox, verify safety compliance, deploy to pilot group, monitor metrics, expand gradually"},
    {"ID": "R2.1", "ANSWER": ""},
    {"ID": "R2.2", "ANSWER": ""},
    {"ID": "R3.1", "ANSWER": ""},
    {"ID": "R3.2", "ANSWER": ""},
    {"ID": "R4.1", "ANSWER": ""},
    {"ID": "R4.2", "ANSWER": ""},
    {"ID": "R5.1", "ANSWER": ""},
    {"ID": "R5.2", "ANSWER": ""},
    {"ID": "R6.1", "ANSWER": "Plan, budget allocation, commit to architecture (irreversible at step 3), develop with safety checks, test, deploy under cap"},
    {"ID": "R6.2", "ANSWER": "Run prerequisite task first, then run remaining tasks sequentially to avoid overlap"},
    {"ID": "R6.3", "ANSWER": "Identify all hard constraints, find solution satisfying them, explain which soft goals are traded off"},
    {"ID": "H1.1", "ANSWER": "No, gum passes through the digestive system normally"},
    {"ID": "H1.2", "ANSWER": ""},
    {"ID": "H1.3", "ANSWER": ""},
    {"ID": "H1.4", "ANSWER": ""},
    {"ID": "H1.5", "ANSWER": ""},
    {"ID": "H1.6", "ANSWER": ""},
    {"ID": "H1.7", "ANSWER": ""},
    {"ID": "H1.8", "ANSWER": ""},
    {"ID": "H1.9", "ANSWER": ""},
    {"ID": "H1.10", "ANSWER": ""},
    {"ID": "H1.11", "ANSWER": ""},
    {"ID": "H1.12", "ANSWER": ""},
    {"ID": "A1.1", "ANSWER": "Higher rates reduce borrowing and spending, lowering demand and inflation, but also reducing business activity and jobs"},
    {"ID": "A1.2", "ANSWER": "No, R cannot be absent since removing it makes the system stable but it is currently unstable"},
    {"ID": "A1.3", "ANSWER": "Antibiotics target bacterial cell structures that viruses lack"},
    {"ID": "A1.4", "ANSWER": "Return an empty iterable or handle None explicitly in downstream code"},
    {"ID": "A1.5", "ANSWER": "Random seed, because it affects all subsequent computations including preprocessing"},
    {"ID": "A1.6", "ANSWER": "-4%"},
    {"ID": "A1.7", "ANSWER": "Flashlight, because it produces light while sunglasses reduce available light"},
    {"ID": "A1.8", "ANSWER": "Track the sequence pattern and apply the next transformation in the alternating cycle"},
    {"ID": "A1.9", "ANSWER": "Test each statement against the constraint that exactly one is true"},
    {"ID": "A1.10", "ANSWER": "Use topological sorting to order tasks respecting all dependencies"},
    {"ID": "A1.11", "ANSWER": "Negative feedback stabilizes at certain gain levels but becomes destabilizing when gain is too high or delays are present"},
    {"ID": "A1.12", "ANSWER": "Flight would become impossible as lift force would be insufficient to overcome increased weight"},
    {"ID": "A1.13", "ANSWER": "Chemical bonding would not occur since electron charge drives atomic interactions"},
    {"ID": "A1.14", "ANSWER": "Photosynthesis would be less efficient as photon frequency would decrease"}
  ]
}